{
  "contract_name": "connector.provider_profile",
  "contract_version": "1.0.0",
  "schema_version": "1.0.0",
  "taxonomy_version": "taxonomy-reason-v1",
  "tenant_id": "tenant-lab-001",
  "customer_context_id": "customer-context-main",
  "environment": "phase0_lab",
  "correlation_id": "corr-provider-profile-rmm-001",
  "causation_id": null,
  "idempotency_key": "idem-provider-profile-rmm-001",
  "producer": {
    "component": "security_reviewer",
    "produced_at": "2026-05-25T21:05:00Z"
  },
  "policy_version": "policy-phase0-v1",
  "provider_profile_id": "provider-profile-rmm-001",
  "connector_type": "rmm_it",
  "provider_ref": "provider-ref-rmm-placeholder-001",
  "provider_status": "review_required",
  "risk_level": "critical",
  "data_classes": [
    "sensitive_finance",
    "sensitive_legal"
  ],
  "outbound_capabilities": [
    "record_mutation",
    "external_send"
  ],
  "object_authorization_status": "missing",
  "property_authorization_status": "failed_closed",
  "token_sensitivity": "critical",
  "revocation_method_status": "missing",
  "disable_switch_status": "missing",
  "rate_limit_status": "missing",
  "prompt_injection_exposure": "critical",
  "export_delete_impact_status": "unknown",
  "policy_refs": [
    "policy.connector_consent_scope_revocation.phase0"
  ],
  "evidence_refs": [
    "ev-provider-profile-rmm-001"
  ],
  "reason_codes": [
    "connector_provider_critical_risk",
    "connector_disable_switch_missing",
    "connector_revocation_unverified",
    "connector_rate_limit_missing"
  ],
  "created_at": "2026-05-25T21:05:00Z",
  "updated_at": "2026-05-25T21:05:00Z"
}
